{
  "manifest_version": 1,
  "network": "xlayer-testnet",
  "chain_id": 1952,
  "rpc_url": "https://testrpc.xlayer.tech/terigon",
  "registry_address": "0x0dAb4A5B7dd24434Ab6564734E26d3d76985352C",
  "registry_runtime_bytecode_sha256": "cecada9e4caefaa153ea321d5831b053ad8750ffe58a4ac0ee61b81ba4dbc561",
  "publisher_address": "0x86A100BDdF8754c95fec97BeC96dBFd64Be44710",
  "publisher_identity_address": "0x86A100BDdF8754c95fec97BeC96dBFd64Be44710",
  "deployer_address": "0xAa1C01C6FcDcc268DbF93C861D26C44a27C35436",
  "operations_address": "0xF901f538d17ED060018F043bCAA1d7f0977Fa65D",
  "confirmations": 3,
  "deployment_block": 38489602,
  "deployment_state": "active",
  "reporting_keys": [
    {
      "kid": "ed25519:394ee022b83de4783cd49f60cc4842b48d108f6a339b73272739490cb9a581fd",
      "public_key": "0959d043538a483024722ced848e52ae5dcaf56661e598dc850a9541028b9dba",
      "state": "active"
    }
  ],
  "max_fee_wei": 2000000000000000
}
