{
  "manifest_version": 1,
  "network": "xlayer-testnet",
  "chain_id": 1952,
  "rpc_url": "https://testrpc.xlayer.tech/terigon",
  "registry_address": "0xc9d58e4496bF061C3177301Ff02518eBB70AD30d",
  "registry_runtime_bytecode_sha256": "7b0b36531a3d9234fb7d72a231b5582a8516f4d99c757fe4298be57d57dd6e2a",
  "publisher_address": "0x86A100BDdF8754c95fec97BeC96dBFd64Be44710",
  "publisher_identity_address": "0x86A100BDdF8754c95fec97BeC96dBFd64Be44710",
  "deployer_address": "0xAa1C01C6FcDcc268DbF93C861D26C44a27C35436",
  "operations_address": "0xF901f538d17ED060018F043bCAA1d7f0977Fa65D",
  "confirmations": 3,
  "max_fee_wei": 2000000000000000,
  "deployment_block": 38369203,
  "deployment_state": "superseded",
  "reporting_keys": [
    {
      "kid": "ed25519:394ee022b83de4783cd49f60cc4842b48d108f6a339b73272739490cb9a581fd",
      "public_key": "0959d043538a483024722ced848e52ae5dcaf56661e598dc850a9541028b9dba",
      "state": "active"
    }
  ],
  "notes": "SUPERSEDED 2026-08-16 \u2014 DO NOT PUBLISH TO THIS REGISTRY. The contract at registry_address predates the epochKey change and has no epochSequence mapping, so it cannot enforce one report per epoch and its runtime bytecode no longer matches what this repository builds. It is refused by deployment_state, which is the only thing that actually refuses it: preflight compares deployed code against the digest THIS MANIFEST RECORDS, and this manifest records the obsolete registry's own digest, so preflight agrees with it. An earlier note here claimed preflight would refuse it; that was false. It published nothing, so there is no history to migrate. At reconstruction time a replacement deployment was an owner gate that had not been requested; the approved replacement was later deployed on 2026-08-17 at 0x0dAb4A5B7dd24434Ab6564734E26d3d76985352C. Reconstructed on 2026-08-15 after the deploy script's manifest write failed on a relative path, leaving the registry live with no record of it. No second deployment was made during that reconstruction. READ FROM THE CHAIN: registry_address (derived from deployer and nonce 0, confirmed by eth_getCode), registry_runtime_bytecode_sha256, deployment_block, chain_id, publisher_identity_address (publisherIdentity()), and the creation transaction bdd1d330764eb6f38d137efd627083230e81447ef7b4b5436b71bddafa4196dd. RECONSTRUCTED CONFIGURATION, not chain facts: rpc_url, confirmations, max_fee_wei, operations_address and reporting_keys \u2014 these were the deploy inputs and the chain does not attest them. Saying every field was read from the deployment was too broad."
}
